issue_id,date,newspaper,place,total_pages,strike_mentioned,front_page_strike,strike_salience,dominant_path,context_Z,notes
iss001,1912-01-15,The Evening Standard,Ogden City UT,8,1,1,high,disorder_path,order_focused,"Front-page 'Rioting of Operatives at Mills in Lawrence': militia, bayonets, ~30,000 idle. A distant Western paper that frames the strike almost entirely as riot/disorder; no improvement response reported."
iss002,1912-01-22,Daily Kennebec Journal,Augusta ME,10,1,1,high,mixed_path,mixed,Front-page 'THE LAWRENCE STRIKE'; 'Sunday passes very quietly' + strikers' committees toward ending strike + call for investigation + 'better wages'. Both order-restoration and improvement signals.
iss003,1912-02-09,Daily Kennebec Journal,Augusta ME,10,1,1,medium,mixed_path,mixed,Continued page-one/inside coverage; sustained strike pressure with mixed framing.
iss004,1912-02-27,The Washington Times,Washington DC,16,1,1,high,development_path,institutional,"Capital paper: 'Immediate Congressional Interference in the Lawrence strike', resolution for congressional investigation, House Rules Committee hearings. Institutional/improvement lens dominant."
iss005,1912-02-27,Daily Kennebec Journal,Augusta ME,12,1,1,high,mixed_path,mixed,Front-page 'LAWRENCE STRIKERS SHOOT FROM AMBUSH ... Disorder Reigns' AND 'pending a congressional investigation'. Disorder and institutional pathways appear in the same issue.
iss006,1912-02-28,Daily Kennebec Journal,Augusta ME,12,1,1,high,development_path,mixed,'INVESTIGATION BY CONGRESS'; House committee on rules hearing Saturday on the Lawrence strike. Improvement/institutional response prominent.
iss007,1912-03-08,Daily Kennebec Journal,Augusta ME,12,1,1,high,development_path,mixed,"'INVESTIGATION TO COME': Senate/House committee examines conditions, child-labor and wage testimony. Improvement pathway, with residual disorder references."
iss008,1912-03-15,Daily Kennebec Journal,Augusta ME,10,1,1,high,development_path,mixed,Strike committee votes to declare strike off 'because of the wage increases granted'; Haywood: 'greatest victory ever won by labor'. Strong improvement/settlement framing.
